{"format":"zotero-fix-proposals","version":1,"created":"2026-10-16T14:23:49Z","group_id":4937409,"name":"NFF","report":"https://ipbes-data.github.io/IPBES.LiteratureReport/IPBES_NFF_4937409.html","checks":[{"id":"retracted","check":"Retracted publications","count":0,"severity":"fix","status":"OK"},{"id":"wrong-doi","check":"DOI points to a different publication","count":4,"severity":"fix","status":"Please fix"},{"id":"duplicates","check":"Items which are in the group more than once","count":66,"severity":"fix","status":"Please fix"},{"id":"invalid-doi","check":"DOI field with an invalid DOI","count":0,"severity":"fix","status":"OK"},{"id":"doi-form","check":"DOI field with a link or prefix instead of the DOI","count":8,"severity":"fix","status":"Please fix"},{"id":"issn-form","check":"ISSN not in the standard form","count":43,"severity":"check","status":"Please check"},{"id":"misplaced-doi","check":"DOI in the wrong field","count":6,"severity":"check","status":"Please check"},{"id":"not-found","check":"DOI not found in OpenAlex","count":18,"severity":"check","status":"Please check"},{"id":"year","check":"Missing or unusual publication year","count":3,"severity":"check","status":"Please check"},{"id":"fill","check":"Empty journal, volume, issue or pages, found in OpenAlex","count":23,"severity":"check","status":"Please check"},{"id":"language","check":"Language not given as a language code","count":8,"severity":"check","status":"Please check"},{"id":"no-identifier","check":"Items without DOI, ISBN, ISSN or URL","count":45,"severity":"check","status":"Please check"},{"id":"doi-candidates","check":"Items without DOI, for which OpenAlex has one","count":9,"severity":"check","status":"Please check"},{"id":"extra-id","check":"OpenAlex ID in Extra not valid","count":0,"severity":"check","status":"OK"},{"id":"openalex-id","check":"Items without their OpenAlex ID in Extra","count":192,"severity":"info","status":"For information"},{"id":"untagged","check":"Items without tags","count":236,"severity":"info","status":"For information"}],"fixes":[{"id":"doi_misplaced","problem":"DOI in wrong field","value":"DOI from other field (URL, Extra)","field":"DOI","check":"misplaced-doi","bulk":false,"changes":[{"item_key":"SZQ8KIFW","title":"ネイチャー・フューチャー枠組：人々、自然、母なる地球 , にとって望ましい将来のシナリオとモデルの開発を支援する柔軟なツール、およびその方法論に関するガイダンス","field":"DOI","old":"","new":"10.5281/zenodo.16416226","reason":"DOI found in the URL field","proposed":true,"note":null,"doi":"10.5281/zenodo.16416226","openalex":null,"choice":null,"preselect":null,"append":null},{"item_key":"DA77Y9IB","title":"Regional Youth Workshop on IPBES for Europe and Central Asia","field":"DOI","old":"","new":"10.19217/skr730","reason":"DOI found in the URL field","proposed":true,"note":null,"doi":"10.19217/skr730","openalex":null,"choice":null,"preselect":null,"append":null},{"item_key":"NUZKZ3FC","title":"The library includes only publications which explicitly mention the Nature Futures Framework, found through a systematic literature search (https://doi.org/10.5281/zenodo.7885022). If you would like to add any new publications to the library, please email us at ipbes-tsu-scenarios@iges.or.jp.","field":"DOI","old":"","new":"10.5281/zenodo.6396542","reason":"DOI found in the URL field","proposed":true,"note":null,"doi":"10.5281/zenodo.6396542","openalex":null,"choice":null,"preselect":null,"append":null},{"item_key":"B48QGH46","title":"New Narratives for Nature: operationalizing the IPBES Nature Futures Scenarios","field":"DOI","old":"","new":"10.5281/zenodo.7727013","reason":"DOI found in the URL field","proposed":true,"note":null,"doi":"10.5281/zenodo.7727013","openalex":null,"choice":null,"preselect":null,"append":null},{"item_key":"3HMAHPSF","title":"Global Modelling of Biodiversity and Ecosystem Services","field":"DOI","old":"","new":"10.5281/zenodo.7726976","reason":"DOI found in the URL field","proposed":true,"note":null,"doi":"10.5281/zenodo.7726976","openalex":null,"choice":null,"preselect":null,"append":null},{"item_key":"359SIE54","title":"From visions to scenarios for nature and nature’s contributions to people for the 21st century","field":"DOI","old":"","new":"10.5281/zenodo.7726944","reason":"DOI found in the URL field","proposed":true,"note":null,"doi":"10.5281/zenodo.7726944","openalex":null,"choice":null,"preselect":null,"append":null}]},{"id":"doi_form","problem":"DOI as link or with prefix","value":"DOI without link or prefix","field":"DOI","check":"doi-form","bulk":false,"changes":[{"item_key":"7AIJ6EKB","title":"Climate response to Nature Future scenarios in a regional Earth System Model","field":"DOI","old":"https://doi.org/10.1038/s41467-026-70284-8","new":"10.1038/s41467-026-70284-8","reason":"DOI as a link or with a prefix","proposed":true,"note":null,"doi":"10.1038/s41467-026-70284-8","openalex":"https://openalex.org/W7137326276","choice":null,"preselect":null,"append":null},{"item_key":"DAKTV4QK","title":"Investigating values of forests in Australia through the Nature Futures Framework","field":"DOI","old":"https://doi.org/10.1007/s11625-026-01881-1","new":"10.1007/s11625-026-01881-1","reason":"DOI as a link or with a prefix","proposed":true,"note":null,"doi":"10.1007/s11625-026-01881-1","openalex":"https://openalex.org/W7203819651","choice":null,"preselect":null,"append":null},{"item_key":"GI8C2ZDE","title":"Exploring desirable urban nature futures: a Q study on local planners’ perspectives in Germany","field":"DOI","old":"https://doi.org/10.1007/s11625-026-01876-y","new":"10.1007/s11625-026-01876-y","reason":"DOI as a link or with a prefix","proposed":true,"note":null,"doi":"10.1007/s11625-026-01876-y","openalex":"https://openalex.org/W7203837156","choice":null,"preselect":null,"append":null},{"item_key":"ADN7Z9EH","title":"Conceptualizing irreconcilable disagreements in the nature futures framework over intrinsic and instrumental values","field":"DOI","old":"https://doi.org/10.1177/09632719261437695","new":"10.1177/09632719261437695","reason":"DOI as a link or with a prefix","proposed":true,"note":null,"doi":"10.1177/09632719261437695","openalex":"https://openalex.org/W7144258331","choice":null,"preselect":null,"append":null},{"item_key":"UABT3R6C","title":"Combining the Viable System Model and Nature Futures Framework.","field":"DOI","old":"https://doi.org/10.1007/s11213-025-09718-1","new":"10.1007/s11213-025-09718-1","reason":"DOI as a link or with a prefix","proposed":true,"note":null,"doi":"10.1007/s11213-025-09718-1","openalex":"https://openalex.org/W4410924459","choice":null,"preselect":null,"append":null},{"item_key":"9P8ILX2I","title":"Capturing Elements of the Nature Futures Framework Through In Situ Place Descriptions: An Empirical Study in Urban Blue Locations","field":"DOI","old":"https://doi.org/10.5281/zenodo.8286255","new":"10.5281/zenodo.8286255","reason":"DOI as a link or with a prefix","proposed":true,"note":null,"doi":"10.5281/zenodo.8286255","openalex":null,"choice":null,"preselect":null,"append":null},{"item_key":"T2X7FRRX","title":"The Living Infinite: Envisioning futures for transformed human-nature relationships on the high seas","field":"DOI","old":"https://doi.org/10.1016/j.marpol.2023.105644","new":"10.1016/j.marpol.2023.105644","reason":"DOI as a link or with a prefix","proposed":true,"note":null,"doi":"10.1016/j.marpol.2023.105644","openalex":"https://openalex.org/W4382236973","choice":null,"preselect":null,"append":null},{"item_key":"LPTVHBNM","title":"Perceptions of Equity in Conservation Scenarios: Half Earth and Sharing the Planet","field":"DOI","old":"https://doi.org/10.1016/j.envsci.2023.03.015","new":"10.1016/j.envsci.2023.03.015","reason":"DOI as a link or with a prefix","proposed":true,"note":null,"doi":"10.1016/j.envsci.2023.03.015","openalex":"https://openalex.org/W4360962551","choice":null,"preselect":null,"append":null}]},{"id":"doi_candidates","problem":"No DOI","value":"DOI found in OpenAlex","field":"DOI","check":"doi-candidates","bulk":false,"changes":[{"item_key":"NX4H36FW","title":"Higher Education Futures: The Transformative Potential of Using Critical Foresights Practices & Arts Based Research in Our Brittle, Anxious, Non-Linear, and Incomprehensible (BANI) World","field":"DOI","old":"","new":"10.15760/etd.7932","reason":"Likely match: Higher Education Futures: The Transformative Potential of Using Critical Foresights Practices & Arts Based Research in Our Brittle, Anxious, Non-Linear, and Incomprehensible (BANI) World (2022, Sheila Mullooly)","proposed":true,"note":null,"doi":"10.15760/etd.7932","openalex":"https://openalex.org/W4286492036","choice":"NX4H36FW","preselect":true,"append":null},{"item_key":"WGSU2TT3","title":"Living Planet Report 2020 - Bending the curve of biodiversity loss","field":"DOI","old":"","new":"10.1163/9789004322714_cclc_2020-0074-0399","reason":"Possible match: LIVING PLANET REPORT 2020: BENDING THE CURVE OF BIODIVERSITY LOSS (2022, no author, Climate Change and Law Collection)","proposed":true,"note":null,"doi":"10.1163/9789004322714_cclc_2020-0074-0399","openalex":"https://openalex.org/W3107307219","choice":"WGSU2TT3","preselect":false,"append":null},{"item_key":"WM6KZZXX","title":"Managing biodiversity in the Anthropocene: discussing the Nature Futures Framework as a tool for adaptive decision-making for nature under climate change","field":"DOI","old":"","new":"10.1007/s11625-022-01200-4","reason":"Possible match: Managing biodiversity in the Anthropocene: discussing the Nature Futures Framework as a tool for adaptive decision-making for nature under climate change (2022, Juliano Palacios‐Abrantes, Sustainability Science)","proposed":false,"note":"DOI used by another item in the group (duplicate?): 10.1007/s11625-022-01200-4","doi":"10.1007/s11625-022-01200-4","openalex":"https://openalex.org/W4296964352","choice":"WM6KZZXX","preselect":false,"append":null},{"item_key":"HKM3TZS2","title":"Plurality in transformative change: three pathways toward nature-positive Europe(s)","fi